Disease,Description,Findings_1,Findings_2
💧 Effusion (Pleural Effusion),"Fluid gathers in the lowest part of the chest, according to the patient's position. If the patient is upright when the X-ray is taken, then fluid will surround the lung base forming a 'meniscus' – a concave line obscuring the costophrenic angle and part or all of the hemidiaphragm.",A large free pleural effusion appears as a dependent opacity with lateral upward sloping of a meniscus-shaped contour.,Blunting of the costophrenic angles.Homogeneous opacity with meniscus sign.
Jaundice,"Yellow staining of the skin and sclerae (the whites of the eyes) by abnormally high blood levels of the bile pigment bilirubin. The yellowing extends to other tissues and body fluids. Jaundice was once called the ""morbus regius"" (the regal disease) in the belief that only the touch of a king could cure it",,
Hepatitis E,A rare form of liver inflammation caused by infection with the hepatitis E virus (HEV). It is transmitted via food or drink handled by an infected person or through infected water supplies in areas where fecal matter may get into the water. Hepatitis E does not cause chronic liver disease.,,
2Mild ,"Mild degeneration of the knee joint, characterized by early cartilage thinning, minor osteophyte formation, and potential soft tissue involvement. Symptoms may include occasional discomfort or stiffness.",Small osteophytes at the joint margins.,"Mild narrowing of the joint space, with no significant subchondral sclerosis."
Dengue,"an acute infectious disease caused by a flavivirus (species Dengue virus of the genus Flavivirus), transmitted by aedes mosquitoes, and characterized by headache, severe joint pain, and a rash. — called also breakbone fever, dengue fever.",,
Infiltration,"A pulmonary infiltrate is a substance denser than air, such as pus, blood, or protein, which lingers within the parenchyma of the lungs.",Patchy or diffuse opacities in lung fields.,"Ill-defined margins, suggesting inflammatory processes."
BDC-BDR,"This refers to the pointed or rounded elevation of enamel located on the buccal side of the molar, towards the distal (back) end of the tooth. It plays a role in grinding food during chewing and is a key feature in identifying and classifying molars. BDR (Buccal Distal Ridge)  is a raised area or linear elevation running along the buccal side, extending from the buccal distal cusp towards the distal part of the tooth. It contributes to the overall shape and function of the occlusal (chewing) surface.","Flattening of the cusp due to grinding, clenching, or normal wear over time.",Plaque or Calculus Buildup is found Common along the ridge due to its anatomy creating plaque-retentive areas.
Hepatitis D,"Hepatitis D, also known as the hepatitis delta virus, is an infection that causes the liver to become inflamed. This swelling can impair liver function and cause long-term liver problems, including liver scarring and cancer. The condition is caused by the hepatitis D virus (HDV).",,
Carcinoma,"Gallbladder carcinoma is a rare but aggressive malignancy arising from the epithelial lining. It often presents late, with nonspecific symptoms like jaundice, weight loss, and persistent right upper quadrant pain.",Irregular mass replacing normal gallbladder architecture.,Invasion into adjacent liver tissue or lymph nodes.
Malignant Breast,A cancerous growth in the breast that has the potential to invade nearby tissues and spread to other parts of the body.,"Irregular, spiculated, or poorly defined masses.","Presence of microcalcifications, architectural distortion, or skin thickening."
Heart attack,"The death of heart muscle due to the loss of blood supply. The loss of blood supply is usually caused by a complete blockage of a coronary artery, one of the arteries that supplies blood to the heart muscle.",,
Benign Breast,"A non-cancerous condition or growth in the breast, such as fibroadenomas, cysts, or fibrocystic changes, that does not invade surrounding tissues.","Well-defined, smooth, and round masses with distinct borders",Absence of microcalcifications or spiculations.
Pneumonia,"Pneumonia is an infection in one or both lungs. Bacteria, viruses, and fungi cause it. The infection causes inflammation in the air sacs in your lungs, which are called alveoli. The alveoli fill with fluid or pus, making it difficult to breathe.",,
Gallbladder Wall Thickening,"Gallbladder wall thickening can be caused by inflammatory, benign, and malignant aetiologies. Pseudothickening caused by the normal postprandial state of the contracted gallbladder is also extremely common",Uniform or focal thickening of the gallbladder wall.,Associated findings such as pericholecystic fluid or biliary sludge.
Arthritis,"Arthritis is the swelling and tenderness of one or more of your joints. The main symptoms of arthritis are joint pain and stiffness, which typically worsen with age. The most common types of arthritis are osteoarthritis and rheumatoid arthritis.",,
Gastroenteritis,"Gastroenteritis is an inflammation of the digestive tract, particularly the stomach, and large and small intestines. Viral and bacterial gastroenteritis are intestinal infections associated with symptoms of diarrhea , abdominal cramps, nausea , and vomiting .",,
Tuberculosis,"Tuberculosis (TB) is an infectious disease usually caused by Mycobacterium tuberculosis (MTB) bacteria. Tuberculosis generally affects the lungs, but can also affect other parts of the body. Most infections show no symptoms, in which case it is known as latent tuberculosis.",,
Caries ,"A progressive destruction of tooth structure caused by acids produced by bacteria in plaque, leading to cavities.","Visible pits, holes, or discoloration.","Sensitivity or pain when consuming hot, cold, or sweet foods."
Normal Breast,"Breast tissue with no abnormalities, showing normal glandular, fatty, and connective tissues.",Symmetrical breast tissue with normal distribution of fat and glandular tissues.,"Absence of masses, calcifications, or architectural distortions."
3Moderate,"Moderate degeneration with noticeable cartilage loss, increased osteophyte formation, and potential subchondral sclerosis. Symptoms may include persistent pain, stiffness, and reduced range of motion.",Moderate joint space narrowing with more pronounced osteophyte formation.,Subchondral sclerosis and potential signs of early deformity.
